"No.","Time","Source","Destination","Protocol","Length","Info"
"1","0.000000000","129.21.85.20","212.19.160.10","TCP","66","49178 > 3389 [SYN] Seq=0 Win=8192 Len=0 MSS=1460 WS=256 SACK_PERM=1"
"2","0.000425000","212.19.160.10","129.21.85.20","TCP","66","3389 > 49178 [SYN, ACK] Seq=0 Ack=1 Win=29200 Len=0 MSS=1460 SACK_PERM=1 WS=128"
"3","0.000442000","129.21.85.20","212.19.160.10","TCP","54","49178 > 3389 [ACK] Seq=1 Ack=1 Win=65536 Len=0"
"4","0.001078000","129.21.85.20","212.19.160.10","COTP","73","CR TPDU src-ref: 0x0000 dst-ref: 0x0000"
"5","0.001575000","212.19.160.10","129.21.85.20","TCP","60","3389 > 49178 [ACK] Seq=1 Ack=20 Win=29312 Len=0"
"6","0.005455000","212.19.160.10","129.21.85.20","COTP","73","CC TPDU src-ref: 0x1234 dst-ref: 0x0000"
"7","0.005650000","129.21.85.20","212.19.160.10","TCP","54","49178 > 3389 [FIN, ACK] Seq=20 Ack=20 Win=65536 Len=0"
"8","0.005891000","212.19.160.10","129.21.85.20","TCP","60","3389 > 49178 [FIN, ACK] Seq=20 Ack=21 Win=29312 Len=0"
"9","0.005907000","129.21.85.20","212.19.160.10","TCP","54","49178 > 3389 [ACK] Seq=21 Ack=21 Win=65536 Len=0"
"10","3.135364000","129.21.85.20","212.19.160.10","TCP","66","49179 > 3389 [SYN] Seq=0 Win=8192 Len=0 MSS=1460 WS=256 SACK_PERM=1"
"11","3.135740000","212.19.160.10","129.21.85.20","TCP","66","3389 > 49179 [SYN, ACK] Seq=0 Ack=1 Win=29200 Len=0 MSS=1460 SACK_PERM=1 WS=128"
"12","3.135758000","129.21.85.20","212.19.160.10","TCP","54","49179 > 3389 [ACK] Seq=1 Ack=1 Win=65536 Len=0"
"13","3.136143000","129.21.85.20","212.19.160.10","COTP","73","CR TPDU src-ref: 0x0000 dst-ref: 0x0000"
"14","3.136372000","212.19.160.10","129.21.85.20","TCP","60","3389 > 49179 [ACK] Seq=1 Ack=20 Win=29312 Len=0"
"15","3.140064000","212.19.160.10","129.21.85.20","COTP","73","CC TPDU src-ref: 0x1234 dst-ref: 0x0000"
"16","3.142448000","129.21.85.20","212.19.160.10","RDP","482","ClientData"
"17","3.142700000","212.19.160.10","129.21.85.20","RDP","583","ServerData Encryption: 128-bit RC4 (High)"
"18","3.142792000","129.21.85.20","212.19.160.10","COTP","66","DT TPDU (0) EOT"
"19","3.142835000","129.21.85.20","212.19.160.10","COTP","62","DT TPDU (0) EOT"
"20","3.143066000","212.19.160.10","129.21.85.20","TCP","60","3389 > 49179 [ACK] Seq=549 Ack=468 Win=30336 Len=0"
"21","3.143066000","212.19.160.10","129.21.85.20","COTP","65","DT TPDU (0) EOT"
"22","3.143243000","129.21.85.20","212.19.160.10","COTP","66","DT TPDU (0) EOT"
"23","3.143468000","212.19.160.10","129.21.85.20","COTP","69","DT TPDU (0) EOT"
"24","3.143579000","129.21.85.20","212.19.160.10","COTP","66","DT TPDU (0) EOT"
"25","3.143768000","212.19.160.10","129.21.85.20","COTP","69","DT TPDU (0) EOT"
"26","3.143870000","129.21.85.20","212.19.160.10","COTP","66","DT TPDU (0) EOT"
"27","3.144058000","212.19.160.10","129.21.85.20","COTP","69","DT TPDU (0) EOT"
"28","3.144191000","129.21.85.20","212.19.160.10","COTP","66","DT TPDU (0) EOT"
"29","3.144363000","212.19.160.10","129.21.85.20","COTP","69","DT TPDU (0) EOT"
"30","3.144449000","129.21.85.20","212.19.160.10","COTP","66","DT TPDU (0) EOT"
"31","3.144626000","212.19.160.10","129.21.85.20","COTP","69","DT TPDU (0) EOT"
"32","3.144712000","129.21.85.20","212.19.160.10","COTP","66","DT TPDU (0) EOT"
"33","3.144877000","212.19.160.10","129.21.85.20","COTP","69","DT TPDU (0) EOT"
"34","3.221660000","129.21.85.20","212.19.160.10","COTP","341","DT TPDU (0) EOT"
"35","3.221966000","129.21.85.20","212.19.160.10","COTP","391","DT TPDU (0) EOT"
"36","3.222178000","212.19.160.10","129.21.85.20","TCP","60","3389 > 49179 [ACK] Seq=650 Ack=1164 Win=32512 Len=0"
"37","3.225484000","212.19.160.10","129.21.85.20","COTP","391","DT TPDU (0) EOT"
"38","3.225987000","129.21.85.20","212.19.160.10","COTP","416","DT TPDU (0) EOT"
"39","3.226256000","212.19.160.10","129.21.85.20","COTP","88","DT TPDU (0) EOT"
"40","3.226297000","212.19.160.10","129.21.85.20","COTP","510","DT TPDU (0) EOT"
"41","3.226304000","129.21.85.20","212.19.160.10","TCP","54","49179 > 3389 [ACK] Seq=1526 Ack=1477 Win=65536 Len=0"
"42","3.282882000","129.21.85.20","212.19.160.10","COTP","711","DT TPDU (0) EOT"
"43","3.283038000","129.21.85.20","212.19.160.10","COTP","102","DT TPDU (0) EOT"
"44","3.283079000","129.21.85.20","212.19.160.10","COTP","106","DT TPDU (0) EOT"
"45","3.283115000","129.21.85.20","212.19.160.10","COTP","106","DT TPDU (0) EOT"
"46","3.283375000","212.19.160.10","129.21.85.20","TCP","60","3389 > 49179 [ACK] Seq=1477 Ack=2231 Win=34816 Len=0"
"47","3.283459000","212.19.160.10","129.21.85.20","TCP","60","3389 > 49179 [ACK] Seq=1477 Ack=2335 Win=34816 Len=0"
"48","3.283565000","212.19.160.10","129.21.85.20","COTP","102","DT TPDU (0) EOT"
"49","3.283608000","212.19.160.10","129.21.85.20","COTP","106","DT TPDU (0) EOT"
"50","3.283617000","129.21.85.20","212.19.160.10","TCP","54","49179 > 3389 [ACK] Seq=2335 Ack=1577 Win=65536 Len=0"
"51","3.283649000","212.19.160.10","129.21.85.20","COTP","106","DT TPDU (0) EOT"
"52","3.283678000","129.21.85.20","212.19.160.10","COTP","106","DT TPDU (0) EOT"
"53","3.283906000","212.19.160.10","129.21.85.20","COTP","106","DT TPDU (0) EOT"
"54","3.283906000","212.19.160.10","129.21.85.20","TPKT","71","Continuation"
"55","3.283931000","129.21.85.20","212.19.160.10","TCP","54","49179 > 3389 [ACK] Seq=2387 Ack=1698 Win=65280 Len=0"
"56","3.287567000","129.21.85.20","212.19.160.10","TPKT","71","Continuation"
"57","3.292231000","212.19.160.10","129.21.85.20","TPKT","248","Continuation"
"58","3.293430000","212.19.160.10","129.21.85.20","TPKT","286","Continuation"
"59","3.293462000","129.21.85.20","212.19.160.10","TCP","54","49179 > 3389 [ACK] Seq=2404 Ack=2124 Win=65024 Len=0"
"60","3.295062000","212.19.160.10","129.21.85.20","TPKT","1514","Continuation"
"61","3.295062000","212.19.160.10","129.21.85.20","TPKT","1514","Continuation"
"62","3.295063000","212.19.160.10","129.21.85.20","TPKT","1514","Continuation"
"63","3.295201000","129.21.85.20","212.19.160.10","TCP","54","49179 > 3389 [ACK] Seq=2404 Ack=6504 Win=65536 Len=0"
"64","3.295241000","212.19.160.10","129.21.85.20","TPKT","1514","Continuation"
"65","3.295242000","212.19.160.10","129.21.85.20","TPKT","1514","Continuation"
"66","3.295242000","212.19.160.10","129.21.85.20","TPKT","1514","Continuation"
"67","3.295260000","129.21.85.20","212.19.160.10","TCP","54","49179 > 3389 [ACK] Seq=2404 Ack=10884 Win=65536 Len=0"
"68","3.295357000","212.19.160.10","129.21.85.20","TPKT","1514","Continuation"
"69","3.295358000","212.19.160.10","129.21.85.20","TPKT","417","Continuation"
"70","3.295434000","129.21.85.20","212.19.160.10","TCP","54","49179 > 3389 [ACK] Seq=2404 Ack=12707 Win=63744 Len=0"
"71","3.295595000","129.21.85.20","212.19.160.10","TCP","54","[TCP Window Update] 49179 > 3389 [ACK] Seq=2404 Ack=12707 Win=65536 Len=0"
"72","3.296674000","212.19.160.10","129.21.85.20","TPKT","1514","Continuation"
"73","3.296675000","212.19.160.10","129.21.85.20","TPKT","1514","Continuation"
"74","3.296695000","212.19.160.10","129.21.85.20","TPKT","1514","Continuation"
"75","3.296695000","212.19.160.10","129.21.85.20","TPKT","1514","Continuation"
"76","3.296695000","212.19.160.10","129.21.85.20","TPKT","1270","Continuation"
"77","3.296736000","129.21.85.20","212.19.160.10","TCP","54","49179 > 3389 [ACK] Seq=2404 Ack=19763 Win=65536 Len=0"
"78","3.297027000","212.19.160.10","129.21.85.20","TPKT","1514","Continuation"
"79","3.297027000","212.19.160.10","129.21.85.20","TPKT","1514","Continuation"
"80","3.297028000","212.19.160.10","129.21.85.20","TPKT","1514","Continuation"
"81","3.297063000","212.19.160.10","129.21.85.20","TPKT","1514","Continuation"
"82","3.297076000","129.21.85.20","212.19.160.10","TCP","54","49179 > 3389 [ACK] Seq=2404 Ack=25603 Win=61184 Len=0"
"83","3.297124000","212.19.160.10","129.21.85.20","TPKT","1514","Continuation"
"84","3.297125000","212.19.160.10","129.21.85.20","TPKT","1514","Continuation"
"85","3.297125000","212.19.160.10","129.21.85.20","TPKT","1078","Continuation"
"86","3.297125000","212.19.160.10","129.21.85.20","TPKT","171","Continuation"
"87","3.297132000","129.21.85.20","212.19.160.10","TCP","54","49179 > 3389 [ACK] Seq=2404 Ack=29664 Win=57088 Len=0"
"88","3.297194000","212.19.160.10","129.21.85.20","TPKT","256","Continuation"
"89","3.297194000","212.19.160.10","129.21.85.20","TPKT","141","Continuation"
"90","3.297194000","212.19.160.10","129.21.85.20","TPKT","107","Continuation"
"91","3.297194000","212.19.160.10","129.21.85.20","TPKT","155","Continuation"
"92","3.297201000","129.21.85.20","212.19.160.10","TCP","54","49179 > 3389 [ACK] Seq=2404 Ack=30107 Win=56576 Len=0"
"93","3.297648000","212.19.160.10","129.21.85.20","TPKT","95","Continuation"
"94","3.297649000","212.19.160.10","129.21.85.20","TPKT","175","Continuation"
"95","3.297649000","212.19.160.10","129.21.85.20","TPKT","141","Continuation"
"96","3.297649000","212.19.160.10","129.21.85.20","TPKT","96","Continuation"
"97","3.297649000","212.19.160.10","129.21.85.20","TPKT","75","Continuation"
"98","3.297661000","129.21.85.20","212.19.160.10","TCP","54","49179 > 3389 [ACK] Seq=2404 Ack=30419 Win=56320 Len=0"
"99","3.298596000","129.21.85.20","212.19.160.10","TCP","54","[TCP Window Update] 49179 > 3389 [ACK] Seq=2404 Ack=30419 Win=65536 Len=0"
"100","3.477987000","129.21.85.20","212.19.160.10","TPKT","76","Continuation"
"101","3.522457000","212.19.160.10","129.21.85.20","TCP","60","3389 > 49179 [ACK] Seq=30419 Ack=2426 Win=34816 Len=0"
"102","3.742978000","129.21.85.20","212.19.160.10","TPKT","78","Continuation"
"103","3.743344000","212.19.160.10","129.21.85.20","TCP","60","3389 > 49179 [ACK] Seq=30419 Ack=2450 Win=34816 Len=0"
"104","3.761121000","129.21.85.20","212.19.160.10","TPKT","78","Continuation"
"105","3.761509000","212.19.160.10","129.21.85.20","TCP","60","3389 > 49179 [ACK] Seq=30419 Ack=2474 Win=34816 Len=0"
"106","3.771965000","129.21.85.20","212.19.160.10","TPKT","134","Continuation"
"107","3.772240000","212.19.160.10","129.21.85.20","TCP","60","3389 > 49179 [ACK] Seq=30419 Ack=2554 Win=34816 Len=0"
"108","3.787083000","129.21.85.20","212.19.160.10","TPKT","134","Continuation"
"109","3.787420000","212.19.160.10","129.21.85.20","TCP","60","3389 > 49179 [ACK] Seq=30419 Ack=2634 Win=34816 Len=0"
"110","3.803477000","129.21.85.20","212.19.160.10","TPKT","141","Continuation"
"111","3.803837000","212.19.160.10","129.21.85.20","TCP","60","3389 > 49179 [ACK] Seq=30419 Ack=2721 Win=34816 Len=0"
"112","3.819988000","129.21.85.20","212.19.160.10","TPKT","134","Continuation"
"113","3.820303000","212.19.160.10","129.21.85.20","TCP","60","3389 > 49179 [ACK] Seq=30419 Ack=2801 Win=34816 Len=0"
"114","3.835087000","129.21.85.20","212.19.160.10","TPKT","134","Continuation"
"115","3.835543000","212.19.160.10","129.21.85.20","TCP","60","3389 > 49179 [ACK] Seq=30419 Ack=2881 Win=34816 Len=0"
"116","3.850349000","129.21.85.20","212.19.160.10","TPKT","127","Continuation"
"117","3.850852000","212.19.160.10","129.21.85.20","TCP","60","3389 > 49179 [ACK] Seq=30419 Ack=2954 Win=34816 Len=0"
"118","3.865993000","129.21.85.20","212.19.160.10","TPKT","148","Continuation"
"119","3.866354000","212.19.160.10","129.21.85.20","TCP","60","3389 > 49179 [ACK] Seq=30419 Ack=3048 Win=34816 Len=0"
"120","3.881034000","129.21.85.20","212.19.160.10","TPKT","134","Continuation"
"121","3.881364000","212.19.160.10","129.21.85.20","TCP","60","3389 > 49179 [ACK] Seq=30419 Ack=3128 Win=34816 Len=0"
"122","3.896059000","129.21.85.20","212.19.160.10","TPKT","127","Continuation"
"123","3.896760000","212.19.160.10","129.21.85.20","TCP","60","3389 > 49179 [ACK] Seq=30419 Ack=3201 Win=34816 Len=0"
"124","3.915682000","129.21.85.20","212.19.160.10","TPKT","99","Continuation"
"125","3.916009000","212.19.160.10","129.21.85.20","TCP","60","3389 > 49179 [ACK] Seq=30419 Ack=3246 Win=34816 Len=0"
"126","3.931252000","129.21.85.20","212.19.160.10","TPKT","71","Continuation"
"127","3.931704000","212.19.160.10","129.21.85.20","TCP","60","3389 > 49179 [ACK] Seq=30419 Ack=3263 Win=34816 Len=0"
"128","3.974056000","129.21.85.20","212.19.160.10","TPKT","71","Continuation"
"129","3.974724000","212.19.160.10","129.21.85.20","TCP","60","3389 > 49179 [ACK] Seq=30419 Ack=3280 Win=34816 Len=0"
"130","3.990042000","129.21.85.20","212.19.160.10","TPKT","120","Continuation"
"131","3.990490000","212.19.160.10","129.21.85.20","TCP","60","3389 > 49179 [ACK] Seq=30419 Ack=3346 Win=34816 Len=0"
"132","4.006531000","129.21.85.20","212.19.160.10","TPKT","155","Continuation"
"133","4.006902000","212.19.160.10","129.21.85.20","TCP","60","3389 > 49179 [ACK] Seq=30419 Ack=3447 Win=34816 Len=0"
"134","4.021531000","129.21.85.20","212.19.160.10","TPKT","155","Continuation"
"135","4.021908000","212.19.160.10","129.21.85.20","TCP","60","3389 > 49179 [ACK] Seq=30419 Ack=3548 Win=34816 Len=0"
"136","4.036559000","129.21.85.20","212.19.160.10","TPKT","134","Continuation"
"137","4.036910000","212.19.160.10","129.21.85.20","TCP","60","3389 > 49179 [ACK] Seq=30419 Ack=3628 Win=34816 Len=0"
"138","4.053003000","129.21.85.20","212.19.160.10","TPKT","148","Continuation"
"139","4.053335000","212.19.160.10","129.21.85.20","TCP","60","3389 > 49179 [ACK] Seq=30419 Ack=3722 Win=34816 Len=0"
"140","4.067723000","129.21.85.20","212.19.160.10","TPKT","134","Continuation"
"141","4.068090000","212.19.160.10","129.21.85.20","TCP","60","3389 > 49179 [ACK] Seq=30419 Ack=3802 Win=34816 Len=0"
"142","4.084030000","129.21.85.20","212.19.160.10","TPKT","141","Continuation"
"143","4.084411000","212.19.160.10","129.21.85.20","TCP","60","3389 > 49179 [ACK] Seq=30419 Ack=3889 Win=34816 Len=0"
"144","4.099107000","129.21.85.20","212.19.160.10","TPKT","162","Continuation"
"145","4.099536000","212.19.160.10","129.21.85.20","TCP","60","3389 > 49179 [ACK] Seq=30419 Ack=3997 Win=34816 Len=0"
"146","4.286919000","129.21.85.20","212.19.160.10","TPKT","113","Continuation"
"147","4.287415000","212.19.160.10","129.21.85.20","TCP","60","3389 > 49179 [ACK] Seq=30419 Ack=4056 Win=34816 Len=0"
"148","4.780202000","129.21.85.20","212.19.160.10","TPKT","71","Continuation"
"149","4.780714000","212.19.160.10","129.21.85.20","TCP","60","3389 > 49179 [ACK] Seq=30419 Ack=4073 Win=34816 Len=0"
"150","4.786071000","129.21.85.20","212.19.160.10","TPKT","99","Continuation"
"151","4.786393000","212.19.160.10","129.21.85.20","TCP","60","3389 > 49179 [ACK] Seq=30419 Ack=4118 Win=34816 Len=0"
"152","4.801115000","129.21.85.20","212.19.160.10","TPKT","148","Continuation"
"153","4.801431000","212.19.160.10","129.21.85.20","TCP","60","3389 > 49179 [ACK] Seq=30419 Ack=4212 Win=34816 Len=0"
"154","4.817618000","129.21.85.20","212.19.160.10","TPKT","155","Continuation"
"155","4.818003000","212.19.160.10","129.21.85.20","TCP","60","3389 > 49179 [ACK] Seq=30419 Ack=4313 Win=34816 Len=0"
"156","4.832612000","129.21.85.20","212.19.160.10","TPKT","127","Continuation"
"157","4.832902000","212.19.160.10","129.21.85.20","TCP","60","3389 > 49179 [ACK] Seq=30419 Ack=4386 Win=34816 Len=0"
"158","4.851669000","129.21.85.20","212.19.160.10","TPKT","113","Continuation"
"159","4.851974000","212.19.160.10","129.21.85.20","TCP","60","3389 > 49179 [ACK] Seq=30419 Ack=4445 Win=34816 Len=0"
"160","4.865248000","129.21.85.20","212.19.160.10","TPKT","78","Continuation"
"161","4.865660000","212.19.160.10","129.21.85.20","TCP","60","3389 > 49179 [ACK] Seq=30419 Ack=4469 Win=34816 Len=0"
"162","4.883852000","129.21.85.20","212.19.160.10","TPKT","85","Continuation"
"163","4.884261000","212.19.160.10","129.21.85.20","TCP","60","3389 > 49179 [ACK] Seq=30419 Ack=4500 Win=34816 Len=0"
"164","4.896673000","129.21.85.20","212.19.160.10","TPKT","92","Continuation"
"165","4.897102000","212.19.160.10","129.21.85.20","TCP","60","3389 > 49179 [ACK] Seq=30419 Ack=4538 Win=34816 Len=0"
"166","4.910137000","129.21.85.20","212.19.160.10","TPKT","120","Continuation"
"167","4.910529000","212.19.160.10","129.21.85.20","TCP","60","3389 > 49179 [ACK] Seq=30419 Ack=4604 Win=34816 Len=0"
"168","4.926148000","129.21.85.20","212.19.160.10","TPKT","148","Continuation"
"169","4.926534000","212.19.160.10","129.21.85.20","TCP","60","3389 > 49179 [ACK] Seq=30419 Ack=4698 Win=34816 Len=0"
"170","4.941248000","129.21.85.20","212.19.160.10","TPKT","134","Continuation"
"171","4.941609000","212.19.160.10","129.21.85.20","TCP","60","3389 > 49179 [ACK] Seq=30419 Ack=4778 Win=34816 Len=0"
"172","4.957734000","129.21.85.20","212.19.160.10","TPKT","155","Continuation"
"173","4.958312000","212.19.160.10","129.21.85.20","TCP","60","3389 > 49179 [ACK] Seq=30419 Ack=4879 Win=34816 Len=0"
"174","4.972611000","129.21.85.20","212.19.160.10","TPKT","148","Continuation"
"175","4.973323000","212.19.160.10","129.21.85.20","TCP","60","3389 > 49179 [ACK] Seq=30419 Ack=4973 Win=34816 Len=0"
"176","4.988237000","129.21.85.20","212.19.160.10","TPKT","155","Continuation"
"177","4.988743000","212.19.160.10","129.21.85.20","TCP","60","3389 > 49179 [ACK] Seq=30419 Ack=5074 Win=34816 Len=0"
"178","5.004728000","129.21.85.20","212.19.160.10","TPKT","141","Continuation"
"179","5.005093000","212.19.160.10","129.21.85.20","TCP","60","3389 > 49179 [ACK] Seq=30419 Ack=5161 Win=34816 Len=0"
"180","5.019712000","129.21.85.20","212.19.160.10","TPKT","141","Continuation"
"181","5.020108000","212.19.160.10","129.21.85.20","TCP","60","3389 > 49179 [ACK] Seq=30419 Ack=5248 Win=34816 Len=0"
"182","5.036125000","129.21.85.20","212.19.160.10","TPKT","155","Continuation"
"183","5.036456000","212.19.160.10","129.21.85.20","TCP","60","3389 > 49179 [ACK] Seq=30419 Ack=5349 Win=34816 Len=0"
"184","5.051185000","129.21.85.20","212.19.160.10","TPKT","148","Continuation"
"185","5.051547000","212.19.160.10","129.21.85.20","TCP","60","3389 > 49179 [ACK] Seq=30419 Ack=5443 Win=34816 Len=0"
"186","5.066178000","129.21.85.20","212.19.160.10","TPKT","162","Continuation"
"187","5.066600000","212.19.160.10","129.21.85.20","TCP","60","3389 > 49179 [ACK] Seq=30419 Ack=5551 Win=34816 Len=0"
"188","5.082271000","129.21.85.20","212.19.160.10","TPKT","141","Continuation"
"189","5.082713000","212.19.160.10","129.21.85.20","TCP","60","3389 > 49179 [ACK] Seq=30419 Ack=5638 Win=34816 Len=0"
"190","5.097258000","129.21.85.20","212.19.160.10","TPKT","127","Continuation"
"191","5.097678000","212.19.160.10","129.21.85.20","TCP","60","3389 > 49179 [ACK] Seq=30419 Ack=5711 Win=34816 Len=0"
"192","5.113631000","129.21.85.20","212.19.160.10","TPKT","141","Continuation"
"193","5.114079000","212.19.160.10","129.21.85.20","TCP","60","3389 > 49179 [ACK] Seq=30419 Ack=5798 Win=34816 Len=0"
"194","5.128635000","129.21.85.20","212.19.160.10","TPKT","127","Continuation"
"195","5.129032000","212.19.160.10","129.21.85.20","TCP","60","3389 > 49179 [ACK] Seq=30419 Ack=5871 Win=34816 Len=0"
"196","5.145156000","129.21.85.20","212.19.160.10","TPKT","141","Continuation"
"197","5.145593000","212.19.160.10","129.21.85.20","TCP","60","3389 > 49179 [ACK] Seq=30419 Ack=5958 Win=34816 Len=0"
"198","5.160189000","129.21.85.20","212.19.160.10","TPKT","127","Continuation"
"199","5.160876000","212.19.160.10","129.21.85.20","TCP","60","3389 > 49179 [ACK] Seq=30419 Ack=6031 Win=34816 Len=0"
"200","5.176167000","129.21.85.20","212.19.160.10","TPKT","134","Continuation"
"201","5.176634000","212.19.160.10","129.21.85.20","TCP","60","3389 > 49179 [ACK] Seq=30419 Ack=6111 Win=34816 Len=0"
"202","5.191129000","129.21.85.20","212.19.160.10","TPKT","120","Continuation"
"203","5.191516000","212.19.160.10","129.21.85.20","TCP","60","3389 > 49179 [ACK] Seq=30419 Ack=6177 Win=34816 Len=0"
"204","5.207627000","129.21.85.20","212.19.160.10","TPKT","106","Continuation"
"205","5.207995000","212.19.160.10","129.21.85.20","TCP","60","3389 > 49179 [ACK] Seq=30419 Ack=6229 Win=34816 Len=0"
"206","5.231937000","129.21.85.20","212.19.160.10","TPKT","92","Continuation"
"207","5.232454000","212.19.160.10","129.21.85.20","TCP","60","3389 > 49179 [ACK] Seq=30419 Ack=6267 Win=34816 Len=0"
"208","5.272923000","129.21.85.20","212.19.160.10","TPKT","71","Continuation"
"209","5.273431000","212.19.160.10","129.21.85.20","TCP","60","3389 > 49179 [ACK] Seq=30419 Ack=6284 Win=34816 Len=0"
"210","5.285811000","129.21.85.20","212.19.160.10","TPKT","85","Continuation"
"211","5.286251000","212.19.160.10","129.21.85.20","TCP","60","3389 > 49179 [ACK] Seq=30419 Ack=6315 Win=34816 Len=0"
"212","5.300028000","129.21.85.20","212.19.160.10","TPKT","106","Continuation"
"213","5.300556000","212.19.160.10","129.21.85.20","TCP","60","3389 > 49179 [ACK] Seq=30419 Ack=6367 Win=34816 Len=0"
"214","5.317185000","129.21.85.20","212.19.160.10","TPKT","134","Continuation"
"215","5.317809000","212.19.160.10","129.21.85.20","TCP","60","3389 > 49179 [ACK] Seq=30419 Ack=6447 Win=34816 Len=0"
"216","5.332197000","129.21.85.20","212.19.160.10","TPKT","120","Continuation"
"217","5.332630000","212.19.160.10","129.21.85.20","TCP","60","3389 > 49179 [ACK] Seq=30419 Ack=6513 Win=34816 Len=0"
"218","5.347750000","129.21.85.20","212.19.160.10","TPKT","134","Continuation"
"219","5.348175000","212.19.160.10","129.21.85.20","TCP","60","3389 > 49179 [ACK] Seq=30419 Ack=6593 Win=34816 Len=0"
"220","5.362686000","129.21.85.20","212.19.160.10","TPKT","127","Continuation"
"221","5.363045000","212.19.160.10","129.21.85.20","TCP","60","3389 > 49179 [ACK] Seq=30419 Ack=6666 Win=34816 Len=0"
"222","5.380199000","129.21.85.20","212.19.160.10","TPKT","120","Continuation"
"223","5.380677000","212.19.160.10","129.21.85.20","TCP","60","3389 > 49179 [ACK] Seq=30419 Ack=6732 Win=34816 Len=0"
"224","5.393808000","129.21.85.20","212.19.160.10","TPKT","120","Continuation"
"225","5.394193000","212.19.160.10","129.21.85.20","TCP","60","3389 > 49179 [ACK] Seq=30419 Ack=6798 Win=34816 Len=0"
"226","5.394373000","212.19.160.10","129.21.85.20","TPKT","71","Continuation"
"227","5.409794000","129.21.85.20","212.19.160.10","TPKT","134","Continuation"
"228","5.424663000","129.21.85.20","212.19.160.10","TPKT","120","Continuation"
"229","5.425016000","212.19.160.10","129.21.85.20","TCP","60","3389 > 49179 [ACK] Seq=30436 Ack=6944 Win=34816 Len=0"
"230","5.448795000","129.21.85.20","212.19.160.10","TPKT","113","Continuation"
"231","5.460460000","129.21.85.20","212.19.160.10","TPKT","78","Continuation"
"232","5.460856000","212.19.160.10","129.21.85.20","TCP","60","3389 > 49179 [ACK] Seq=30436 Ack=7027 Win=34816 Len=0"
"233","5.461930000","212.19.160.10","129.21.85.20","TPKT","71","Continuation"
"234","5.544969000","129.21.85.20","212.19.160.10","TPKT","71","Continuation"
"235","5.560747000","129.21.85.20","212.19.160.10","TPKT","78","Continuation"
"236","5.561099000","212.19.160.10","129.21.85.20","TCP","60","3389 > 49179 [ACK] Seq=30453 Ack=7068 Win=34816 Len=0"
"237","5.566713000","129.21.85.20","212.19.160.10","TPKT","71","Continuation"
"238","5.586767000","129.21.85.20","212.19.160.10","TPKT","92","Continuation"
"239","5.587389000","212.19.160.10","129.21.85.20","TCP","60","3389 > 49179 [ACK] Seq=30453 Ack=7123 Win=34816 Len=0"
"240","5.604330000","129.21.85.20","212.19.160.10","TPKT","71","Continuation"
"241","5.605423000","212.19.160.10","129.21.85.20","TPKT","71","Continuation"
"242","5.616841000","129.21.85.20","212.19.160.10","TPKT","71","Continuation"
"243","5.658258000","212.19.160.10","129.21.85.20","TCP","60","3389 > 49179 [ACK] Seq=30470 Ack=7157 Win=34816 Len=0"
"244","5.765474000","129.21.85.20","212.19.160.10","TPKT","78","Continuation"
"245","5.766020000","212.19.160.10","129.21.85.20","TCP","60","3389 > 49179 [ACK] Seq=30470 Ack=7181 Win=34816 Len=0"
"246","5.769417000","129.21.85.20","212.19.160.10","TPKT","71","Continuation"
"247","5.769741000","212.19.160.10","129.21.85.20","TCP","60","3389 > 49179 [ACK] Seq=30470 Ack=7198 Win=34816 Len=0"
"248","5.788766000","129.21.85.20","212.19.160.10","TPKT","99","Continuation"
"249","5.789220000","212.19.160.10","129.21.85.20","TCP","60","3389 > 49179 [ACK] Seq=30470 Ack=7243 Win=34816 Len=0"
"250","5.789405000","212.19.160.10","129.21.85.20","TPKT","71","Continuation"
"251","5.804225000","129.21.85.20","212.19.160.10","TPKT","85","Continuation"
"252","5.816511000","129.21.85.20","212.19.160.10","TPKT","78","Continuation"
"253","5.816953000","212.19.160.10","129.21.85.20","TCP","60","3389 > 49179 [ACK] Seq=30487 Ack=7298 Win=34816 Len=0"
"254","5.817149000","212.19.160.10","129.21.85.20","TPKT","71","Continuation"
"255","5.899470000","129.21.85.20","212.19.160.10","TPKT","78","Continuation"
"256","5.942735000","212.19.160.10","129.21.85.20","TCP","60","3389 > 49179 [ACK] Seq=30504 Ack=7322 Win=34816 Len=0"
"257","5.955523000","129.21.85.20","212.19.160.10","TPKT","71","Continuation"
"258","5.956069000","212.19.160.10","129.21.85.20","TCP","60","3389 > 49179 [ACK] Seq=30504 Ack=7339 Win=34816 Len=0"
"259","5.981982000","129.21.85.20","212.19.160.10","TPKT","78","Continuation"
"260","5.982954000","212.19.160.10","129.21.85.20","TCP","60","3389 > 49179 [ACK] Seq=30504 Ack=7363 Win=34816 Len=0"
"261","5.988380000","129.21.85.20","212.19.160.10","TPKT","71","Continuation"
"262","5.988955000","212.19.160.10","129.21.85.20","TCP","60","3389 > 49179 [ACK] Seq=30504 Ack=7380 Win=34816 Len=0"
"263","6.002823000","129.21.85.20","212.19.160.10","TPKT","71","Continuation"
"264","6.003451000","212.19.160.10","129.21.85.20","TCP","60","3389 > 49179 [ACK] Seq=30504 Ack=7397 Win=34816 Len=0"
"265","6.033595000","129.21.85.20","212.19.160.10","TPKT","78","Continuation"
"266","6.034016000","212.19.160.10","129.21.85.20","TCP","60","3389 > 49179 [ACK] Seq=30504 Ack=7421 Win=34816 Len=0"
"267","6.034084000","212.19.160.10","129.21.85.20","TPKT","80","Continuation"
"268","6.034123000","212.19.160.10","129.21.85.20","TPKT","73","Continuation"
"269","6.034130000","129.21.85.20","212.19.160.10","TCP","54","49179 > 3389 [ACK] Seq=7421 Ack=30549 Win=65536 Len=0"
"270","6.104526000","129.21.85.20","212.19.160.10","TPKT","71","Continuation"
"271","6.105016000","212.19.160.10","129.21.85.20","TPKT","73","Continuation"
"272","6.105066000","212.19.160.10","129.21.85.20","TPKT","73","Continuation"
"273","6.105073000","129.21.85.20","212.19.160.10","TCP","54","49179 > 3389 [ACK] Seq=7438 Ack=30587 Win=65280 Len=0"
"274","6.751766000","129.21.85.20","212.19.160.10","TPKT","66","Continuation"
"275","6.752226000","212.19.160.10","129.21.85.20","TPKT","100","Continuation"
"276","6.835845000","129.21.85.20","212.19.160.10","TPKT","66","Continuation"
"277","6.878355000","212.19.160.10","129.21.85.20","TCP","60","3389 > 49179 [ACK] Seq=30633 Ack=7462 Win=34816 Len=0"
"278","6.939837000","129.21.85.20","212.19.160.10","TPKT","66","Continuation"
"279","6.940277000","212.19.160.10","129.21.85.20","TCP","60","3389 > 49179 [ACK] Seq=30633 Ack=7474 Win=34816 Len=0"
"280","6.940343000","212.19.160.10","129.21.85.20","TPKT","86","Continuation"
"281","7.023859000","129.21.85.20","212.19.160.10","TPKT","66","Continuation"
"282","7.066326000","212.19.160.10","129.21.85.20","TCP","60","3389 > 49179 [ACK] Seq=30665 Ack=7486 Win=34816 Len=0"
"283","7.115783000","129.21.85.20","212.19.160.10","TPKT","66","Continuation"
"284","7.116174000","212.19.160.10","129.21.85.20","TCP","60","3389 > 49179 [ACK] Seq=30665 Ack=7498 Win=34816 Len=0"
"285","7.116300000","212.19.160.10","129.21.85.20","TPKT","83","Continuation"
"286","7.187877000","129.21.85.20","212.19.160.10","TPKT","66","Continuation"
"287","7.230374000","212.19.160.10","129.21.85.20","TCP","60","3389 > 49179 [ACK] Seq=30694 Ack=7510 Win=34816 Len=0"
"288","7.363841000","129.21.85.20","212.19.160.10","TPKT","66","Continuation"
"289","7.364304000","212.19.160.10","129.21.85.20","TCP","60","3389 > 49179 [ACK] Seq=30694 Ack=7522 Win=34816 Len=0"
"290","7.364304000","212.19.160.10","129.21.85.20","TPKT","112","Continuation"
"291","7.463835000","129.21.85.20","212.19.160.10","TPKT","66","Continuation"
"292","7.503831000","129.21.85.20","212.19.160.10","TPKT","66","Continuation"
"293","7.504268000","212.19.160.10","129.21.85.20","TCP","60","3389 > 49179 [ACK] Seq=30752 Ack=7546 Win=34816 Len=0"
"294","7.504407000","212.19.160.10","129.21.85.20","TPKT","84","Continuation"
"295","7.596038000","129.21.85.20","212.19.160.10","TPKT","66","Continuation"
"296","7.596621000","212.19.160.10","129.21.85.20","TPKT","83","Continuation"
"297","7.599683000","129.21.85.20","212.19.160.10","TPKT","66","Continuation"
"298","7.642426000","212.19.160.10","129.21.85.20","TCP","60","3389 > 49179 [ACK] Seq=30811 Ack=7570 Win=34816 Len=0"
"299","7.711804000","129.21.85.20","212.19.160.10","TPKT","66","Continuation"
"300","7.712231000","212.19.160.10","129.21.85.20","TCP","60","3389 > 49179 [ACK] Seq=30811 Ack=7582 Win=34816 Len=0"
"301","8.075874000","129.21.85.20","212.19.160.10","TPKT","66","Continuation"
"302","8.076313000","212.19.160.10","129.21.85.20","TCP","60","3389 > 49179 [ACK] Seq=30811 Ack=7594 Win=34816 Len=0"
"303","8.076392000","212.19.160.10","129.21.85.20","TPKT","80","Continuation"
"304","8.076456000","212.19.160.10","129.21.85.20","TPKT","80","Continuation"
"305","8.076464000","129.21.85.20","212.19.160.10","TCP","54","49179 > 3389 [ACK] Seq=7594 Ack=30863 Win=65024 Len=0"
"306","8.163821000","129.21.85.20","212.19.160.10","TPKT","66","Continuation"
"307","8.206724000","212.19.160.10","129.21.85.20","TCP","60","3389 > 49179 [ACK] Seq=30863 Ack=7606 Win=34816 Len=0"
"308","8.835865000","129.21.85.20","212.19.160.10","TPKT","66","Continuation"
"309","8.836351000","212.19.160.10","129.21.85.20","TCP","60","3389 > 49179 [ACK] Seq=30863 Ack=7618 Win=34816 Len=0"
"310","8.836464000","212.19.160.10","129.21.85.20","TPKT","111","Continuation"
"311","8.943693000","129.21.85.20","212.19.160.10","TPKT","66","Continuation"
"312","8.986573000","212.19.160.10","129.21.85.20","TCP","60","3389 > 49179 [ACK] Seq=30920 Ack=7630 Win=34816 Len=0"
"313","9.011849000","129.21.85.20","212.19.160.10","TPKT","66","Continuation"
"314","9.012306000","212.19.160.10","129.21.85.20","TCP","60","3389 > 49179 [ACK] Seq=30920 Ack=7642 Win=34816 Len=0"
"315","9.012426000","212.19.160.10","129.21.85.20","TPKT","88","Continuation"
"316","9.111860000","129.21.85.20","212.19.160.10","TPKT","66","Continuation"
"317","9.154535000","212.19.160.10","129.21.85.20","TCP","60","3389 > 49179 [ACK] Seq=30954 Ack=7654 Win=34816 Len=0"
"318","9.307871000","129.21.85.20","212.19.160.10","TPKT","66","Continuation"
"319","9.308331000","212.19.160.10","129.21.85.20","TCP","60","3389 > 49179 [ACK] Seq=30954 Ack=7666 Win=34816 Len=0"
"320","9.308469000","212.19.160.10","129.21.85.20","TPKT","80","Continuation"
"321","9.415836000","129.21.85.20","212.19.160.10","TPKT","66","Continuation"
"322","9.458626000","212.19.160.10","129.21.85.20","TCP","60","3389 > 49179 [ACK] Seq=30980 Ack=7678 Win=34816 Len=0"
"323","9.487788000","129.21.85.20","212.19.160.10","TPKT","66","Continuation"
"324","9.489239000","212.19.160.10","129.21.85.20","TCP","60","3389 > 49179 [ACK] Seq=30980 Ack=7690 Win=34816 Len=0"
"325","9.489240000","212.19.160.10","129.21.85.20","TPKT","80","Continuation"
"326","9.563807000","129.21.85.20","212.19.160.10","TPKT","66","Continuation"
"327","9.595814000","129.21.85.20","212.19.160.10","TPKT","66","Continuation"
"328","9.596302000","212.19.160.10","129.21.85.20","TCP","60","3389 > 49179 [ACK] Seq=31006 Ack=7714 Win=34816 Len=0"
"329","9.596416000","212.19.160.10","129.21.85.20","TPKT","80","Continuation"
"330","9.699683000","129.21.85.20","212.19.160.10","TPKT","66","Continuation"
"331","9.754677000","212.19.160.10","129.21.85.20","TCP","60","3389 > 49179 [ACK] Seq=31032 Ack=7726 Win=34816 Len=0"
"332","9.799837000","129.21.85.20","212.19.160.10","TPKT","66","Continuation"
"333","9.800233000","212.19.160.10","129.21.85.20","TCP","60","3389 > 49179 [ACK] Seq=31032 Ack=7738 Win=34816 Len=0"
"334","9.800383000","212.19.160.10","129.21.85.20","TPKT","80","Continuation"
"335","9.863781000","129.21.85.20","212.19.160.10","TPKT","66","Continuation"
"336","9.906620000","212.19.160.10","129.21.85.20","TCP","60","3389 > 49179 [ACK] Seq=31058 Ack=7750 Win=34816 Len=0"
"337","10.239719000","129.21.85.20","212.19.160.10","TPKT","66","Continuation"
"338","10.240416000","212.19.160.10","129.21.85.20","TCP","60","3389 > 49179 [ACK] Seq=31058 Ack=7762 Win=34816 Len=0"
"339","10.240417000","212.19.160.10","129.21.85.20","TPKT","80","Continuation"
"340","10.335770000","129.21.85.20","212.19.160.10","TPKT","66","Continuation"
"341","10.378728000","212.19.160.10","129.21.85.20","TCP","60","3389 > 49179 [ACK] Seq=31084 Ack=7774 Win=34816 Len=0"
"342","10.436604000","129.21.85.20","212.19.160.10","TPKT","66","Continuation"
"343","10.436955000","212.19.160.10","129.21.85.20","TCP","60","3389 > 49179 [ACK] Seq=31084 Ack=7786 Win=34816 Len=0"
"344","10.437442000","212.19.160.10","129.21.85.20","TPKT","80","Continuation"
"345","10.499794000","129.21.85.20","212.19.160.10","TPKT","66","Continuation"
"346","10.531756000","129.21.85.20","212.19.160.10","TPKT","66","Continuation"
"347","10.532248000","212.19.160.10","129.21.85.20","TCP","60","3389 > 49179 [ACK] Seq=31110 Ack=7810 Win=34816 Len=0"
"348","10.599700000","129.21.85.20","212.19.160.10","TPKT","66","Continuation"
"349","10.654301000","212.19.160.10","129.21.85.20","TCP","60","3389 > 49179 [ACK] Seq=31110 Ack=7822 Win=34816 Len=0"
"350","11.136940000","212.19.160.10","129.21.85.20","TPKT","87","Continuation"
"351","11.353176000","129.21.85.20","212.19.160.10","TCP","54","49179 > 3389 [ACK] Seq=7822 Ack=31143 Win=64768 Len=0"
"352","11.399527000","129.21.85.20","212.19.160.10","TPKT","71","Continuation"
"353","11.399983000","212.19.160.10","129.21.85.20","TCP","60","3389 > 49179 [ACK] Seq=31143 Ack=7839 Win=34816 Len=0"
"354","11.402893000","129.21.85.20","212.19.160.10","TPKT","71","Continuation"
"355","11.403200000","212.19.160.10","129.21.85.20","TCP","60","3389 > 49179 [ACK] Seq=31143 Ack=7856 Win=34816 Len=0"
"356","11.417891000","129.21.85.20","212.19.160.10","TPKT","99","Continuation"
"357","11.418236000","212.19.160.10","129.21.85.20","TCP","60","3389 > 49179 [ACK] Seq=31143 Ack=7901 Win=34816 Len=0"
"358","11.430966000","129.21.85.20","212.19.160.10","TPKT","127","Continuation"
"359","11.431369000","212.19.160.10","129.21.85.20","TCP","60","3389 > 49179 [ACK] Seq=31143 Ack=7974 Win=34816 Len=0"
"360","11.446989000","129.21.85.20","212.19.160.10","TPKT","141","Continuation"
"361","11.447360000","212.19.160.10","129.21.85.20","TCP","60","3389 > 49179 [ACK] Seq=31143 Ack=8061 Win=34816 Len=0"
"362","11.468886000","129.21.85.20","212.19.160.10","TPKT","113","Continuation"
"363","11.469560000","212.19.160.10","129.21.85.20","TCP","60","3389 > 49179 [ACK] Seq=31143 Ack=8120 Win=34816 Len=0"
"364","11.779079000","129.21.85.20","212.19.160.10","TPKT","71","Continuation"
"365","11.779496000","212.19.160.10","129.21.85.20","TCP","60","3389 > 49179 [ACK] Seq=31143 Ack=8137 Win=34816 Len=0"
"366","11.789891000","129.21.85.20","212.19.160.10","TPKT","106","Continuation"
"367","11.790220000","212.19.160.10","129.21.85.20","TCP","60","3389 > 49179 [ACK] Seq=31143 Ack=8189 Win=34816 Len=0"
"368","11.806443000","129.21.85.20","212.19.160.10","TPKT","141","Continuation"
"369","11.806750000","212.19.160.10","129.21.85.20","TCP","60","3389 > 49179 [ACK] Seq=31143 Ack=8276 Win=34816 Len=0"
"370","11.821360000","129.21.85.20","212.19.160.10","TPKT","141","Continuation"
"371","11.821710000","212.19.160.10","129.21.85.20","TCP","60","3389 > 49179 [ACK] Seq=31143 Ack=8363 Win=34816 Len=0"
"372","11.837414000","129.21.85.20","212.19.160.10","TPKT","141","Continuation"
"373","11.837772000","212.19.160.10","129.21.85.20","TCP","60","3389 > 49179 [ACK] Seq=31143 Ack=8450 Win=34816 Len=0"
"374","11.852474000","129.21.85.20","212.19.160.10","TPKT","134","Continuation"
"375","11.853099000","212.19.160.10","129.21.85.20","TCP","60","3389 > 49179 [ACK] Seq=31143 Ack=8530 Win=34816 Len=0"
"376","11.868871000","129.21.85.20","212.19.160.10","TPKT","148","Continuation"
"377","11.869354000","212.19.160.10","129.21.85.20","TCP","60","3389 > 49179 [ACK] Seq=31143 Ack=8624 Win=34816 Len=0"
"378","11.883933000","129.21.85.20","212.19.160.10","TPKT","141","Continuation"
"379","11.884626000","212.19.160.10","129.21.85.20","TCP","60","3389 > 49179 [ACK] Seq=31143 Ack=8711 Win=34816 Len=0"
"380","11.898971000","129.21.85.20","212.19.160.10","TPKT","148","Continuation"
"381","11.899358000","212.19.160.10","129.21.85.20","TCP","60","3389 > 49179 [ACK] Seq=31143 Ack=8805 Win=34816 Len=0"
"382","11.914972000","129.21.85.20","212.19.160.10","TPKT","148","Continuation"
"383","11.915350000","212.19.160.10","129.21.85.20","TCP","60","3389 > 49179 [ACK] Seq=31143 Ack=8899 Win=34816 Len=0"
"384","11.929950000","129.21.85.20","212.19.160.10","TPKT","141","Continuation"
"385","11.946441000","129.21.85.20","212.19.160.10","TPKT","162","Continuation"
"386","11.961456000","129.21.85.20","212.19.160.10","TPKT","141","Continuation"
"387","11.974349000","212.19.160.10","129.21.85.20","TCP","60","3389 > 49179 [ACK] Seq=31143 Ack=9181 Win=34816 Len=0"
"388","11.977891000","129.21.85.20","212.19.160.10","TPKT","148","Continuation"
"389","11.992597000","129.21.85.20","212.19.160.10","TPKT","134","Continuation"
"390","12.008946000","129.21.85.20","212.19.160.10","TPKT","148","Continuation"
"391","12.023902000","129.21.85.20","212.19.160.10","TPKT","134","Continuation"
"392","12.040434000","129.21.85.20","212.19.160.10","TPKT","162","Continuation"
"393","12.040722000","212.19.160.10","129.21.85.20","TCP","60","3389 > 49179 [ACK] Seq=31143 Ack=9637 Win=34816 Len=0"
"394","12.055564000","129.21.85.20","212.19.160.10","TPKT","141","Continuation"
"395","12.070450000","129.21.85.20","212.19.160.10","TPKT","141","Continuation"
"396","12.086922000","129.21.85.20","212.19.160.10","TPKT","134","Continuation"
"397","12.087255000","212.19.160.10","129.21.85.20","TCP","60","3389 > 49179 [ACK] Seq=31143 Ack=9891 Win=34816 Len=0"
"398","12.102922000","129.21.85.20","212.19.160.10","TPKT","106","Continuation"
"399","12.119975000","129.21.85.20","212.19.160.10","TPKT","92","Continuation"
"400","12.133560000","129.21.85.20","212.19.160.10","TPKT","85","Continuation"
"401","12.146382000","212.19.160.10","129.21.85.20","TCP","60","3389 > 49179 [ACK] Seq=31143 Ack=10012 Win=34816 Len=0"
"402","12.148671000","129.21.85.20","212.19.160.10","TPKT","85","Continuation"
"403","12.169541000","129.21.85.20","212.19.160.10","TPKT","92","Continuation"
"404","12.184653000","129.21.85.20","212.19.160.10","TPKT","71","Continuation"
"405","12.199076000","129.21.85.20","212.19.160.10","TPKT","71","Continuation"
"406","12.199468000","212.19.160.10","129.21.85.20","TCP","60","3389 > 49179 [ACK] Seq=31143 Ack=10115 Win=34816 Len=0"
"407","12.218220000","129.21.85.20","212.19.160.10","TPKT","71","Continuation"
"408","12.231012000","129.21.85.20","212.19.160.10","TPKT","71","Continuation"
"409","12.242994000","129.21.85.20","212.19.160.10","TPKT","85","Continuation"
"410","12.260569000","129.21.85.20","212.19.160.10","TPKT","92","Continuation"
"411","12.260940000","212.19.160.10","129.21.85.20","TCP","60","3389 > 49179 [ACK] Seq=31143 Ack=10218 Win=34816 Len=0"
"412","12.276524000","129.21.85.20","212.19.160.10","TPKT","99","Continuation"
"413","12.289506000","129.21.85.20","212.19.160.10","TPKT","99","Continuation"
"414","12.306032000","129.21.85.20","212.19.160.10","TPKT","113","Continuation"
"415","12.306403000","212.19.160.10","129.21.85.20","TCP","60","3389 > 49179 [ACK] Seq=31143 Ack=10367 Win=34816 Len=0"
"416","12.324068000","129.21.85.20","212.19.160.10","TPKT","106","Continuation"
"417","12.338966000","129.21.85.20","212.19.160.10","TPKT","92","Continuation"
"418","12.352445000","129.21.85.20","212.19.160.10","TPKT","92","Continuation"
